<?xml version="1.0" encoding="UTF-8"?>
<CatanGame xmlns:xsi="http://www.w3.org/2001/XMLSchema-instance" xsi:noNamespaceSchemaLocation="file:///C:/Users/Spider/Documents/GitHub/catan/php/gameXML.xsd">
	<!-- 
	Valid Game States:
		Initial - initial settlement placements don't have requirement of roads to lead in.
		Ongoing - Normal game rules apply
		Complete - Game Over
	-->
	<GameState>Initial-0-Settlement</GameState>
	<GameNumber>1234567890</GameNumber>
	<Players turn="player1">
		<Player id="player1">
			<Points>0</Points>
			<Resources>
				<Brick>0</Brick>
				<Lumber>0</Lumber>
				<Ore>0</Ore>
				<Wheat>0</Wheat>
				<Wool>0</Wool>
			</Resources>
		</Player>
		<Player id="player2">
			<Points>0</Points>
			<Resources>
				<Brick>0</Brick>
				<Lumber>0</Lumber>
				<Ore>0</Ore>
				<Wheat>0</Wheat>
				<Wool>0</Wool>
			</Resources>
		</Player>
	</Players>
	<GameBoard>
		<Robber Row="0" Col="0"/>
		<Tiles>
			<Tile Row="0" Col="0" ResType="desert" DieNumber="10" TR="" LR="" RR="" BR="" TLC="" TRC="" BLC="" BRC=""/>
			<Tile Row="0" Col="1" ResType="desert" DieNumber="10" TR="" LR="" RR="" BR="" TLC="" TRC="" BLC="" BRC=""/>
			<Tile Row="0" Col="1" ResType="desert" DieNumber="10" TR="" LR="" RR="" BR="" TLC="" TRC="" BLC="" BRC=""/>
			<Tile Row="0" Col="3" ResType="desert" DieNumber="11" TR="" LR="" RR="" BR="" TLC="" TRC="" BLC="" BRC=""/>
			<Tile Row="1" Col="0" ResType="desert" DieNumber="11" TR="" LR="" RR="" BR="" TLC="" TRC="" BLC="" BRC=""/>
			<Tile Row="1" Col="1" ResType="desert" DieNumber="11" TR="" LR="" RR="" BR="" TLC="" TRC="" BLC="" BRC=""/>
			<Tile Row="1" Col="2" ResType="desert" DieNumber="11" TR="" LR="" RR="" BR="" TLC="" TRC="" BLC="" BRC=""/>
			<Tile Row="1" Col="3" ResType="desert" DieNumber="11" TR="" LR="" RR="" BR="" TLC="" TRC="" BLC="" BRC=""/>
			<Tile Row="2" Col="0" ResType="desert" DieNumber="11" TR="" LR="" RR="" BR="" TLC="" TRC="" BLC="" BRC=""/>
			<Tile Row="2" Col="1" ResType="desert" DieNumber="11" TR="" LR="" RR="" BR="" TLC="" TRC="" BLC="" BRC=""/>
			<Tile Row="2" Col="2" ResType="desert" DieNumber="11" TR="" LR="" RR="" BR="" TLC="" TRC="" BLC="" BRC=""/>
			<Tile Row="2" Col="3" ResType="desert" DieNumber="11" TR="" LR="" RR="" BR="" TLC="" TRC="" BLC="" BRC=""/>
			<Tile Row="3" Col="0" ResType="desert" DieNumber="11" TR="" LR="" RR="" BR="" TLC="" TRC="" BLC="" BRC=""/>
			<Tile Row="3" Col="1" ResType="desert" DieNumber="11" TR="" LR="" RR="" BR="" TLC="" TRC="" BLC="" BRC=""/>
			<Tile Row="3" Col="2" ResType="desert" DieNumber="11" TR="" LR="" RR="" BR="" TLC="" TRC="" BLC="" BRC=""/>
			<Tile Row="3" Col="3" ResType="desert" DieNumber="11" TR="" LR="" RR="" BR="" TLC="" TRC="" BLC="" BRC=""/>
		</Tiles>
	</GameBoard>
</CatanGame>
